Date,Type,Facts,Full_Draft
2026-02-16 13:13,Divorce Petition,based on cuelty,"The two documents provide complementary perspectives on the subject of cruelty: one outlining its specific manifestations as legal grounds for divorce, and the other detailing its broad-ranging risks for individuals and society.

Here is a merged document, integrating the specific examples of cruelty within a legal context with the comprehensive analysis of its risks:

---

## Understanding Cruelty: Manifestations, Legal Grounds, and Broad-Ranging Risks

Cruelty, whether directed at humans or animals, carries a multitude of severe and interconnected risks for all involved parties and society as a whole. It is a profoundly destructive force, leaving lasting scars on individuals and creating a ripple effect of negative consequences throughout families, communities, and society at large. Addressing and preventing cruelty is essential for the well-being and safety of all.

### 1. Cruelty as Legal Grounds: A Focus on Unreasonable Behaviour in Marital Contexts

In legal proceedings, particularly in family courts, acts of cruelty often constitute grounds for divorce, recognized as ""unreasonable behaviour"" that makes it intolerable for one party to continue living with the other. The particulars of such cruel and unreasonable behaviour can include, but are not limited to, the following:

*   **Emotional/Verbal Abuse**: A pattern of severe and sustained emotional and verbal abuse, including routine degradation, belittling, and public humiliation. This often involves consistently undermining a person's self-worth and decision-making capabilities, and can include gaslighting that causes the victim to question their own sanity.
*   **Physical Abuse/Threats**: Engaging in acts or threats of physical violence. This may range from shoving, hitting, or causing bruising, to raising a hand in a threatening manner, damaging property during an argument, or creating a constant state of apprehension for physical safety.
*   **Financial Cruelty/Control**: Systematically exercising coercive financial control. This can manifest as withholding necessary funds despite ample means, monitoring all expenditures, demanding receipts for minor purchases, prohibiting employment or access to marital assets, or deliberately accumulating significant debt in the victim's name without consent. This behaviour causes severe financial distress and anxiety.
*   **Isolation/Control**: Deliberately isolating an individual from friends and family, actively discouraging and sometimes forbidding social interaction. Tactics include intercepting messages and calls, demanding to accompany the victim to all social engagements (and then creating arguments), or criticizing relationships with others, leading to profound loneliness and a loss of personal support networks.
*   **Neglect/Lack of Support**: Demonstrating a complete lack of emotional support and profound indifference to the victim's well-being, particularly during times of illness or personal distress. This may involve expressing resentment regarding the impact of the victim's health or circumstances on the abuser's own life, rather than offering comfort or assistance.

The cumulative effect of such conduct severely and detrimentally impacts the victim's mental and physical health, leading to conditions like diagnosed anxiety, depression, chronic stress, and sleep disturbances.

### 2. Comprehensive Risks and Impacts of Cruelty

The risks associated with cruelty extend beyond the immediate acts, affecting victims, perpetrators, and society at large in profound ways.

#### 2.1 Risks for the Victim (Human or Animal):

*   **Physical Harm:** Injuries (minor to severe), chronic pain, disability, disfigurement, malnutrition, illness, and ultimately, death.
*   **Psychological Trauma:**
    *   **PTSD (Post-Traumatic Stress Disorder):** Flashbacks, nightmares, hyper-vigilance, avoidance.
    *   **C-PTSD (Complex PTSD):** Resulting from prolonged, repeated trauma, leading to difficulties with emotional regulation, distorted self-perception, relationship issues, and loss of meaning.
    *   **Anxiety and Depression:** Chronic fear, panic attacks, hopelessness, anhedonia (inability to feel pleasure).
    *   **Low Self-Esteem and Self-Worth:** Internalized shame, guilt, and a belief that they deserve the abuse.
    *   **Dissociation:** Detachment from one's body, thoughts, or reality as a coping mechanism.
    *   **Suicidal Ideation or Attempts:** Especially in cases of severe or prolonged abuse.
*   **Emotional Distress:** Fear, terror, rage, profound sadness, grief, helplessness, loss of trust.
*   **Social Isolation:** Victims may withdraw, be shunned by others, or abusers may actively isolate them. Difficulty forming healthy relationships due to trust issues.
*   **Developmental Impairment (especially in children/young animals):** Impaired brain development, attachment disorders, learning difficulties, behavioral problems, stunted growth.
*   **Behavioral Changes:** Aggression, self-harm, substance abuse, eating disorders, or extreme passivity.
*   **Economic Disadvantage:** Inability to work, loss of employment, medical costs, homelessness, becoming dependent on the abuser.

#### 2.2 Risks for the Perpetrator:

*   **Legal Consequences:** Arrest, criminal charges (assault, battery, torture, animal cruelty, neglect, murder), conviction, fines, imprisonment, restraining orders, sex offender registration.
*   **Social Repercussions:** Ostracization, loss of relationships (family, friends), reputational damage, difficulty finding employment or housing.
*   **Psychological Desensitization:** Continued cruelty can erode empathy and moral compass, making it easier to commit further acts of violence.
*   **Escalation of Violence:** Cruelty often escalates in frequency and severity over time.
*   **Personal Safety Risks:** Potential for retaliation from victims or others.

#### 2.3 Risks for Society and Community:

*   **Normalization of Violence:** When cruelty is ignored or goes unpunished, it can become normalized, lowering societal standards of acceptable behavior.
*   **Cycle of Violence:** Children who witness or experience cruelty are at a higher risk of becoming victims or perpetrators themselves.
*   **Breakdown of Trust and Social Cohesion:** Cruelty erodes the fabric of trust between individuals and institutions.
*   **Increased Crime Rates:** Unaddressed cruelty can foster a climate where other criminal behaviors are more likely to occur.
*   **Economic Burden:** Costs associated with law enforcement, incarceration, healthcare for victims, social services, and lost productivity.
*   **Moral Decay:** A society that tolerates cruelty risks losing its moral compass and valuing compassion less.
*   **Public Health Crisis:** The mental and physical health consequences of cruelty contribute to public health burdens.
*   **Risk to Public Safety:** Individuals capable of cruelty towards animals are often a risk to human safety (the ""link"" between animal abuse and human violence).

---
**Note:** The detailed legal formatting of the ""Divorce Petition"" from Document 1 (e.g., Case No., prayers for specific orders, statement of truth, law firm details) has been omitted from this merged document, as it pertains to the specific structure of a legal filing rather than the general exposition of cruelty itself. However, the substance of how cruelty is described as grounds for legal action has been fully integrated."
